{
  "task": "autofill-auth-interactions",
  "developer": "saiteja",
  "branch": "saiteja/autofill-auth-interactions",
  "latest_commit": "f859dddd4008e1119aff60e2d2d91f4ab22c8491",
  "pr": "",
  "files_touched": [
    "src/autofill/account_flow.py",
    "src/autofill/dom_ui.py",
    "src/autofill/engine.py",
    "src/autofill/login.py",
    "src/autofill/mapping.py",
    "src/autofill/safeguards.py",
    "tests/fixtures/workday_sso_sign_in.html",
    "tests/fixtures/workday_terms_react.html",
    "tests/test_auth_interactions.py"
  ],
  "tests": "pytest tests/test_auth_interactions.py",
  "blockers": "",
  "next_action": "",
  "updated_at": "2026-10-25T22:35:13Z"
}
