{
  "task": "autofill-auth-followup",
  "developer": "saiteja",
  "branch": "saiteja/autofill-auth-followup",
  "latest_commit": "0a2a44bdf5d9de9be5a9a48ba95aa00b32586726",
  "pr": "https://github.com/VK-TECH-LABS/Auto-Fill/pull/70",
  "files_touched": [
    "src/autofill/account_flow.py",
    "src/autofill/login.py",
    "src/autofill/safeguards.py",
    "src/autofill/service/app.py"
  ],
  "tests": "pytest tests/test_auth_followup.py",
  "blockers": "",
  "next_action": "",
  "updated_at": "2026-10-25T23:40:05Z"
}
