{
  "task": "autofill-account-outcome",
  "developer": "saiteja",
  "branch": "saiteja/autofill-account-outcome",
  "latest_commit": "dd462487883429efb001717d625126ce819b3016",
  "pr": "https://github.com/VK-TECH-LABS/Auto-Fill/pull/74",
  "files_touched": [
    "src/autofill/account_flow.py",
    "src/autofill/service/app.py",
    "tests/fixtures/workday_create_then_sign_in.html",
    "tests/test_account_outcome.py"
  ],
  "tests": "pytest tests/test_account_outcome.py",
  "blockers": "",
  "next_action": "",
  "updated_at": "2026-10-26T19:36:47Z"
}
