{
  "task": "salary-related-answers",
  "developer": "tharun",
  "branch": "tharun/salary-related-answers",
  "latest_commit": "08729636cbdc8d286db2c6f7bffd6dcd256a2b35",
  "pr": "https://github.com/VK-TECH-LABS/Auto-Fill/pull/72",
  "files_touched": [
    "docs/HTTP_SERVICE.md",
    "docs/TILEARC_INTEGRATION.md",
    "src/autofill/service/schemas.py"
  ],
  "tests": "pytest tests/test_salary.py tests/test_mapping.py tests/test_intents.py tests/test_flow.py::test_salary_and_work_auth_are_not_invented tests/test_nav_optional_blockers.py::test_work_status_is_not_a_disability_question_and_base_salary_is_salary",
  "blockers": "",
  "next_action": "Review the staging PR. A desired salary range with only a saved minimum must stay blank and return challenge confirm. Do not invent a max.",
  "updated_at": "2026-10-26T10:17:21Z"
}
