{
  "task": "autofill-r4-verify-pending-continue",
  "developer": "saiteja",
  "branch": "saiteja/autofill-r4-verify-pending-continue",
  "latest_commit": "8016e88b70c7ee91d9c472a20f81a98ccb85985b",
  "pr": "https://github.com/VK-TECH-LABS/Auto-Fill/pull/83",
  "files_touched": [
    "src/autofill/service/app.py",
    "src/autofill/service/schemas.py",
    "tests/test_verify_pending.py",
    "tests/test_verify_pending_continue.py"
  ],
  "tests": "pytest tests/test_verify_pending.py tests/test_verify_pending_continue.py",
  "blockers": "",
  "next_action": "",
  "updated_at": "2026-10-28T06:09:59Z"
}
