{
  "task": "hold-final-submit-4669",
  "developer": "saiteja",
  "branch": "saiteja/hold-final-submit-4669",
  "latest_commit": "1e322379568df3fcd8a999b45f60a2deb0a96057",
  "pr": "https://github.com/VK-TECH-LABS/Auto-Fill/pull/100",
  "files_touched": [
    "src/autofill/engine.py",
    "src/autofill/fill.py",
    "src/autofill/local_attach.py",
    "src/autofill/pagewait.py",
    "src/autofill/safeguards.py",
    "tests/test_last_field_submit.py",
    "tests/test_page_type.py"
  ],
  "tests": "pytest tests/test_last_field_submit.py tests/test_page_type.py",
  "blockers": "",
  "next_action": "",
  "updated_at": "2026-10-31T13:27:48Z"
}
