{
  "task": "continue-autofill-resume",
  "developer": "tharun",
  "branch": "tharun/continue-autofill-resume",
  "latest_commit": "3838786ec87b6c1fbd5103fd6b4a49d5fd22acd9",
  "pr": "https://github.com/VK-TECH-LABS/Auto-Fill/pull/65",
  "files_touched": [
    "docs/HTTP_SERVICE.md",
    "src/autofill/login.py",
    "src/autofill/service/app.py"
  ],
  "tests": "pytest tests/test_continue_autofill.py tests/test_real_ats.py tests/test_fill.py tests/test_nav_optional_blockers.py tests/test_protocol_070.py tests/test_protocol_060.py",
  "blockers": "",
  "next_action": "Review the staging PR. A visible ADP contact form should fill and click Continue. A real checkbox still stops, and resume restarts only after that stop is gone.",
  "updated_at": "2026-10-25T13:24:31Z"
}
