{
  "task": "autofill-r4-resume-upload",
  "developer": "saiteja",
  "branch": "saiteja/autofill-r4-resume-upload",
  "latest_commit": "05dc7c31b0beaef352adc5de7107cc2e0f3f4a18",
  "pr": "",
  "files_touched": [
    "src/autofill/engine.py",
    "src/autofill/local_attach.py",
    "src/autofill/local_helper.py",
    "tests/test_local_helper.py"
  ],
  "tests": "pytest tests/test_local_helper.py",
  "blockers": "",
  "next_action": "",
  "updated_at": "2026-10-30T05:26:48Z"
}
