{
  "task": "autofill-signin-instead-creds",
  "developer": "saiteja",
  "branch": "saiteja/autofill-signin-instead-creds",
  "latest_commit": "c31933bf547f7b725051fb1af4de2601e9921a91",
  "pr": "",
  "files_touched": [
    "src/autofill/account_flow.py",
    "tests/fixtures/workday_saved_login_header.html",
    "tests/test_saved_login_pane.py"
  ],
  "tests": "pytest tests/test_saved_login_pane.py",
  "blockers": "",
  "next_action": "",
  "updated_at": "2026-10-26T23:09:45Z"
}
