{
  "task": "autofill-verify-pending",
  "developer": "saiteja",
  "branch": "saiteja/autofill-verify-pending",
  "latest_commit": "ccb236e405c22c164d91c1cbff77a5c0dfa0356b",
  "pr": "",
  "files_touched": [
    "src/autofill/engine.py",
    "src/autofill/service/app.py",
    "src/autofill/service/runner.py",
    "src/autofill/service/sessions.py",
    "tests/fixtures/workday_create_then_sign_in.html",
    "tests/test_verify_pending.py"
  ],
  "tests": "pytest tests/test_verify_pending.py",
  "blockers": "",
  "next_action": "",
  "updated_at": "2026-10-26T20:33:44Z"
}
