{
  "task": "autofill-register-settle",
  "developer": "saiteja",
  "branch": "saiteja/autofill-register-settle",
  "latest_commit": "bc90951ee98d9cc4bb97b84fc5bfa11cf7bb39a7",
  "pr": "https://github.com/VK-TECH-LABS/Auto-Fill/pull/71",
  "files_touched": [
    "src/autofill/account_flow.py"
  ],
  "tests": "pytest tests/test_auth_followup.py",
  "blockers": "",
  "next_action": "",
  "updated_at": "2026-10-26T01:05:03Z"
}
