{
  "task": "autofill-r3-save-continue",
  "developer": "saiteja",
  "branch": "saiteja/autofill-r3-save-continue",
  "latest_commit": "b125b5a0a0a787dcf5c54df3f128c92c049ffb5d",
  "pr": "https://github.com/VK-TECH-LABS/Auto-Fill/pull/91",
  "files_touched": [
    "src/autofill/answer_popup.py",
    "src/autofill/local_attach.py",
    "src/autofill/local_helper.py",
    "tests/fixtures/save_continue_two_pages.html",
    "tests/test_save_continue.py"
  ],
  "tests": "pytest tests/test_save_continue.py",
  "blockers": "",
  "next_action": "",
  "updated_at": "2026-10-29T22:18:21Z"
}
