{
  "task": "workday-fill-nav-50d7",
  "developer": "tharun",
  "branch": "tharun/workday-fill-nav-50d7",
  "latest_commit": "67faa1d8ebb40f39c9feecf15cadf90a10c4a9b8",
  "pr": "https://github.com/VK-TECH-LABS/Auto-Fill/pull/76",
  "files_touched": [
    "src/autofill/combobox.py",
    "src/autofill/extract.py",
    "src/autofill/mapping.py",
    "src/autofill/models.py",
    "src/autofill/pagewait.py",
    "src/autofill/stepfill.py",
    "tests/test_workday_fill_nav.py"
  ],
  "tests": "pytest tests/test_workday_fill_nav.py",
  "blockers": "",
  "next_action": "",
  "updated_at": "2026-10-26T22:50:00Z"
}
