{
  "task": "autofill-r1-session-binding",
  "developer": "saiteja",
  "branch": "saiteja/autofill-r1-session-binding",
  "latest_commit": "e4bd8a8a634da7a19f56a9a37f815ca557ab1bc5",
  "pr": "",
  "files_touched": [
    "src/autofill/engine.py",
    "src/autofill/local_attach.py",
    "src/autofill/local_helper.py",
    "tests/test_local_attach.py",
    "tests/test_local_helper.py"
  ],
  "tests": "pytest tests/test_local_attach.py tests/test_local_helper.py",
  "blockers": "",
  "next_action": "",
  "updated_at": "2026-10-29T18:32:37Z"
}
